{
  "experiment_id": "R2D-CAPELLA-AB-001",
  "project_checkpoint_blocker": "LIVE_UX_ACCEPTANCE_PENDING",
  "factory_runtime_status": "BLOCKED",
  "factory_runtime_reason_code": "SAP_CONNECTION_FAILED",
  "rap_readiness": "BRIDGE_UNAVAILABLE",
  "bridge_reachable": false,
  "sap_write_authority": "NONE",
  "checkpoint_next_action": "Execute one fresh Full-Stack UX request through existing Govern -> Approval",
  "safe_to_execute_checkpoint_next_action_now": false,
  "current_availability_authority": "CURRENT_RUNTIME",
  "prohibited_reinvestigation": [
    "BACKEND_EXECUTION_REDESIGN",
    "PROVEN_TOOLCHAIN_PROFILE_REOPENING"
  ]
}
